{"builtAt":"2026-10-28T13:23:37.027067+00:00","candidate":{"center":{"lat":40.4340468696,"lon":-80.0926506672},"city":"Pittsburgh","id":"e483b1b1-6f5b-492f-9244-83db5bb21d78","name":"Chartiers Country Club","state":"PA"},"dataVersion":"approved-2026-10-28-2684","holes":[{"back":{"lat":40.4359421,"lon":-80.0992947},"center":{"lat":40.435938319444446,"lon":-80.09910609166667},"features":[{"kind":"green","points":[{"lat":40.4360053,"lon":-80.0989517},{"lat":40.4360082,"lon":-80.0989782},{"lat":40.4360125,"lon":-80.0990057},{"lat":40.436019,"lon":-80.0990351},{"lat":40.4360226,"lon":-80.0990588},{"lat":40.4360284,"lon":-80.0990797},{"lat":40.4360284,"lon":-80.0991025},{"lat":40.4360295,"lon":-80.0991376},{"lat":40.4360271,"lon":-80.0991695},{"lat":40.4360204,"lon":-80.099195},{"lat":40.4360101,"lon":-80.0992277},{"lat":40.4359985,"lon":-80.0992532},{"lat":40.4359834,"lon":-80.099274},{"lat":40.4359621,"lon":-80.0992915},{"lat":40.4359421,"lon":-80.0992947},{"lat":40.4359227,"lon":-80.0992939},{"lat":40.4359081,"lon":-80.0992907},{"lat":40.4358954,"lon":-80.0992819},{"lat":40.4358778,"lon":-80.0992692},{"lat":40.4358608,"lon":-80.09925},{"lat":40.4358486,"lon":-80.0992325},{"lat":40.4358419,"lon":-80.0992094},{"lat":40.4358365,"lon":-80.0991783},{"lat":40.4358365,"lon":-80.0991448},{"lat":40.4358383,"lon":-80.0991121},{"lat":40.4358413,"lon":-80.0990754},{"lat":40.4358468,"lon":-80.0990403},{"lat":40.4358589,"lon":-80.0990044},{"lat":40.4358693,"lon":-80.0989813},{"lat":40.4358899,"lon":-80.0989462},{"lat":40.4359045,"lon":-80.0989215},{"lat":40.435919,"lon":-80.0989047},{"lat":40.4359415,"lon":-80.098896},{"lat":40.4359652,"lon":-80.098896},{"lat":40.435984,"lon":-80.0989095},{"lat":40.4359949,"lon":-80.0989263},{"lat":40.4360053,"lon":-80.0989517}]},{"kind":"fairway","points":[{"lat":40.4359949,"lon":-80.0989263},{"lat":40.4360041,"lon":-80.0988933},{"lat":40.4360148,"lon":-80.0988589},{"lat":40.4360324,"lon":-80.0988183},{"lat":40.4360496,"lon":-80.0987789},{"lat":40.4360638,"lon":-80.0987445},{"lat":40.4360771,"lon":-80.0987191},{"lat":40.4360981,"lon":-80.0986869},{"lat":40.4361174,"lon":-80.0986593},{"lat":40.4361333,"lon":-80.09863},{"lat":40.4361449,"lon":-80.0986029},{"lat":40.4361535,"lon":-80.0985623},{"lat":40.436159,"lon":-80.0985223},{"lat":40.4361633,"lon":-80.09848},{"lat":40.4361741,"lon":-80.0983842},{"lat":40.4361831,"lon":-80.0982962},{"lat":40.4362002,"lon":-80.0981648},{"lat":40.4362238,"lon":-80.0980058},{"lat":40.4362376,"lon":-80.0979049},{"lat":40.436253,"lon":-80.097787},{"lat":40.436243,"lon":-80.0977116},{"lat":40.4362402,"lon":-80.0976145},{"lat":40.4362723,"lon":-80.0975169},{"lat":40.4362758,"lon":-80.0973692},{"lat":40.4362753,"lon":-80.0972936},{"lat":40.4362749,"lon":-80.0972091},{"lat":40.4362766,"lon":-80.0971166},{"lat":40.4362706,"lon":-80.0969767},{"lat":40.4362625,"lon":-80.0968707},{"lat":40.4362552,"lon":-80.0967687},{"lat":40.4362436,"lon":-80.09667},{"lat":40.4362264,"lon":-80.0965775},{"lat":40.4362002,"lon":-80.0964794},{"lat":40.4361732,"lon":-80.0963751},{"lat":40.4361492,"lon":-80.0962877},{"lat":40.4361264,"lon":-80.0962144},{"lat":40.4361045,"lon":-80.096162},{"lat":40.4360783,"lon":-80.0961163},{"lat":40.4360517,"lon":-80.0960881},{"lat":40.4360045,"lon":-80.0960729},{"lat":40.4359595,"lon":-80.0960864},{"lat":40.435923,"lon":-80.0961309},{"lat":40.4358968,"lon":-80.0961851},{"lat":40.4358848,"lon":-80.0962759},{"lat":40.4358904,"lon":-80.0963937},{"lat":40.4358985,"lon":-80.0965104},{"lat":40.4359105,"lon":-80.09663},{"lat":40.4359161,"lon":-80.096701},{"lat":40.4359135,"lon":-80.0967687},{"lat":40.4359084,"lon":-80.0968155},{"lat":40.4359071,"lon":-80.0968561},{"lat":40.4359196,"lon":-80.0968877},{"lat":40.4359479,"lon":-80.0969192},{"lat":40.4359852,"lon":-80.0969666},{"lat":40.4360157,"lon":-80.0970134},{"lat":40.4360371,"lon":-80.0970715},{"lat":40.4360453,"lon":-80.0971273},{"lat":40.4360453,"lon":-80.0971771},{"lat":40.4360453,"lon":-80.097182},{"lat":40.4360384,"lon":-80.0972339},{"lat":40.4360247,"lon":-80.097279},{"lat":40.4360093,"lon":-80.0973145},{"lat":40.4359942,"lon":-80.0973517},{"lat":40.4359942,"lon":-80.0974058},{"lat":40.436005,"lon":-80.0974583},{"lat":40.4360037,"lon":-80.0975226},{"lat":40.4359899,"lon":-80.0975863},{"lat":40.4359672,"lon":-80.0976477},{"lat":40.435956,"lon":-80.0976996},{"lat":40.435947,"lon":-80.0977836},{"lat":40.4359483,"lon":-80.0978863},{"lat":40.4359547,"lon":-80.0980233},{"lat":40.435953,"lon":-80.0981845},{"lat":40.4359517,"lon":-80.0983345},{"lat":40.4359505,"lon":-80.098493},{"lat":40.4359462,"lon":-80.0986041},{"lat":40.4359341,"lon":-80.0987168},{"lat":40.4359213,"lon":-80.0988251},{"lat":40.4359148,"lon":-80.0988804},{"lat":40.435919,"lon":-80.0989047},{"lat":40.4359415,"lon":-80.098896},{"lat":40.4359652,"lon":-80.098896},{"lat":40.435984,"lon":-80.0989095},{"lat":40.4359949,"lon":-80.0989263}]},{"kind":"tee","points":[{"lat":40.4359439,"lon":-80.0945286},{"lat":40.4359418,"lon":-80.0945467},{"lat":40.4359345,"lon":-80.0945659},{"lat":40.4359246,"lon":-80.0945777},{"lat":40.4359135,"lon":-80.094589},{"lat":40.4359002,"lon":-80.0945929},{"lat":40.4358869,"lon":-80.0945873},{"lat":40.4358731,"lon":-80.094576},{"lat":40.4358624,"lon":-80.0945608},{"lat":40.4358555,"lon":-80.0945467},{"lat":40.4358512,"lon":-80.0945247},{"lat":40.4358542,"lon":-80.094501},{"lat":40.435862,"lon":-80.0944818},{"lat":40.4358736,"lon":-80.0944655},{"lat":40.435886,"lon":-80.0944553},{"lat":40.4359019,"lon":-80.0944508},{"lat":40.4359195,"lon":-80.0944576},{"lat":40.4359315,"lon":-80.09447},{"lat":40.4359396,"lon":-80.094488},{"lat":40.4359444,"lon":-80.09451},{"lat":40.4359439,"lon":-80.0945286}]},{"kind":"tee","points":[{"lat":40.4359555,"lon":-80.0947688},{"lat":40.4359551,"lon":-80.0947999},{"lat":40.4359538,"lon":-80.0948359},{"lat":40.4359504,"lon":-80.0948675},{"lat":40.4359405,"lon":-80.0948957},{"lat":40.4359276,"lon":-80.0949149},{"lat":40.4359143,"lon":-80.0949205},{"lat":40.4358984,"lon":-80.0949211},{"lat":40.435886,"lon":-80.0949115},{"lat":40.4358753,"lon":-80.0948985},{"lat":40.4358675,"lon":-80.0948788},{"lat":40.4358624,"lon":-80.0948444},{"lat":40.4358602,"lon":-80.0948117},{"lat":40.4358585,"lon":-80.0947767},{"lat":40.4358581,"lon":-80.0947452},{"lat":40.4358564,"lon":-80.0947181},{"lat":40.4358577,"lon":-80.094691},{"lat":40.4358645,"lon":-80.094669},{"lat":40.4358791,"lon":-80.0946533},{"lat":40.4358976,"lon":-80.0946414},{"lat":40.4359143,"lon":-80.0946409},{"lat":40.4359302,"lon":-80.0946437},{"lat":40.4359427,"lon":-80.0946555},{"lat":40.4359508,"lon":-80.0946775},{"lat":40.435953,"lon":-80.0947125},{"lat":40.435953,"lon":-80.0947418},{"lat":40.4359555,"lon":-80.0947688}]},{"kind":"tee","points":[{"lat":40.4357625,"lon":-80.0952706},{"lat":40.4357597,"lon":-80.0952881},{"lat":40.4357552,"lon":-80.0953041},{"lat":40.4357464,"lon":-80.0953188},{"lat":40.4357385,"lon":-80.0953244},{"lat":40.4357288,"lon":-80.0953268},{"lat":40.4357188,"lon":-80.09532},{"lat":40.4357091,"lon":-80.0953081},{"lat":40.4357039,"lon":-80.0952917},{"lat":40.4357,"lon":-80.0952722},{"lat":40.4357018,"lon":-80.0952526},{"lat":40.4357084,"lon":-80.0952311},{"lat":40.4357148,"lon":-80.0952136},{"lat":40.435726,"lon":-80.0951972},{"lat":40.4357394,"lon":-80.0951992},{"lat":40.4357503,"lon":-80.095208},{"lat":40.4357588,"lon":-80.0952295},{"lat":40.4357619,"lon":-80.0952503},{"lat":40.4357625,"lon":-80.0952706}]},{"kind":"tee","points":[{"lat":40.4355526,"lon":-80.099149},{"lat":40.4355512,"lon":-80.0991672},{"lat":40.4355465,"lon":-80.0991843},{"lat":40.4355385,"lon":-80.0991996},{"lat":40.4355282,"lon":-80.0992036},{"lat":40.4355157,"lon":-80.0991978},{"lat":40.4355033,"lon":-80.0991795},{"lat":40.4354938,"lon":-80.0991541},{"lat":40.4354922,"lon":-80.0991246},{"lat":40.4354936,"lon":-80.0990976},{"lat":40.4354999,"lon":-80.0990769},{"lat":40.4355077,"lon":-80.0990645},{"lat":40.4355188,"lon":-80.0990616},{"lat":40.4355326,"lon":-80.0990707},{"lat":40.4355421,"lon":-80.0990816},{"lat":40.4355479,"lon":-80.0990983},{"lat":40.435552,"lon":-80.0991231},{"lat":40.4355526,"lon":-80.099149}]},{"kind":"tee","points":[{"lat":40.4355651,"lon":-80.0992997},{"lat":40.4355665,"lon":-80.0993154},{"lat":40.4355642,"lon":-80.0993332},{"lat":40.4355584,"lon":-80.0993485},{"lat":40.4355454,"lon":-80.0993572},{"lat":40.435534,"lon":-80.0993602},{"lat":40.4355224,"lon":-80.0993572},{"lat":40.4355119,"lon":-80.0993496},{"lat":40.4355066,"lon":-80.0993339},{"lat":40.4355052,"lon":-80.099315},{"lat":40.4355085,"lon":-80.0992928},{"lat":40.435516,"lon":-80.0992782},{"lat":40.4355257,"lon":-80.0992669},{"lat":40.4355382,"lon":-80.099264},{"lat":40.4355496,"lon":-80.0992706},{"lat":40.4355587,"lon":-80.0992793},{"lat":40.4355651,"lon":-80.0992997}]},{"kind":"bunker","points":[{"lat":40.4360919,"lon":-80.0992005},{"lat":40.4361003,"lon":-80.0990777},{"lat":40.4360872,"lon":-80.0989727},{"lat":40.4361155,"lon":-80.0989028},{"lat":40.4361247,"lon":-80.0988486},{"lat":40.4360876,"lon":-80.0988316},{"lat":40.4360488,"lon":-80.0988486},{"lat":40.4360293,"lon":-80.0988835},{"lat":40.4360284,"lon":-80.0989499},{"lat":40.4360463,"lon":-80.09906},{"lat":40.4360536,"lon":-80.0991533},{"lat":40.4360536,"lon":-80.0991765},{"lat":40.4360629,"lon":-80.0992047},{"lat":40.4360919,"lon":-80.0992005}]},{"kind":"bunker","points":[{"lat":40.4362502,"lon":-80.0976541},{"lat":40.4362712,"lon":-80.097547},{"lat":40.4362804,"lon":-80.0975363},{"lat":40.4363277,"lon":-80.0974642},{"lat":40.436364,"lon":-80.0974991},{"lat":40.4363256,"lon":-80.0975692},{"lat":40.4363015,"lon":-80.0976589},{"lat":40.4362502,"lon":-80.0976541}]},{"kind":"bunker","points":[{"lat":40.4360128,"lon":-80.0972998},{"lat":40.4359722,"lon":-80.0972946},{"lat":40.4359834,"lon":-80.0972249},{"lat":40.4359879,"lon":-80.097164},{"lat":40.4359742,"lon":-80.097117},{"lat":40.4359277,"lon":-80.0970978},{"lat":40.435926,"lon":-80.0970346},{"lat":40.4359553,"lon":-80.0970028},{"lat":40.4359627,"lon":-80.0969855},{"lat":40.4